"Climate Change","Cambio climático","Changement climatique"
"Food, Security and Hunger","Alimento, seguridad y hambre","Alimentaire, de la sécurité et de la faim"
"Geographic and Socioeconomic","Geográfico y socioeconómico","Géographique et socio-économique"
"Land and Gender","Tierra y género","Terrain et le sexe"
"Land Tenure","Propiedad de la tierra","Foncière"
"Land use, agriculture and investment","Uso de la tierra, agricultura e inversión","L'utilisation des terres, de l'agriculture et de l'investissement"